{
  "citation_substance": "substantive",
  "rationale": "The cited paper is discussed repeatedly in the body of the article, not merely listed as general background. The authors use specific findings from Sun, Neslin, and Srinivasan (2003) - such as evidence of forward-looking purchase planning and effects of expected future promotions - to support their argument about when Lucas-critique issues arise in marketing models. They also use it in the methodological discussion to contrast reduced-form proxies with structural approaches for policy analysis. This repeated, specific use gives the citation a meaningful conceptual role.",
  "relation_description": "The citing paper uses Sun, Neslin, and Srinivasan (2003) as key empirical and methodological support for its claim that forward-looking consumer behavior can undermine policy simulations from reduced-form models. It helps ground the paper's framework for when Lucas-critique concerns matter and why structural models are often preferable for large policy changes.",
  "relation_type": "foundational_for"
}