{
  "citation_substance": "mention_only",
  "rationale": "The citing paper mentions Lee and Bradlow (2011) only once in an introductory grouped citation to show broader academic interest in online reviews. The paper does not assign a specific conceptual or methodological role to that study in its hypothesis development, empirical design, or interpretation of results. Most of the substantive framing and evidence base is instead tied to deception and review-manipulation literature, so this citation functions as general background.",
  "relation_description": null,
  "relation_type": null
}