{
  "citation_substance": "substantive",
  "rationale": "The cited paper is treated as a central methodological predecessor for incentive-compatible point-of-purchase willingness-to-pay measurement, not just background. The citing paper explicitly says its ICERANGE procedure builds on BDM in the style of Wertenbroch and Skiera, and it reuses key design logic (real purchase enforcement, anti-strategic setup, respondent protocol choices). It then positions its contribution by contrasting ICERANGE with BDM's single-point elicitation and benchmarking predictive performance against BDM in both studies.",
  "relation_description": "The citing paper extends Wertenbroch and Skiera's BDM-based point-of-purchase WTP approach by adding a multi-threshold reservation-price range tied to purchase probabilities. It preserves the incentive-compatible core while introducing additional elicitation steps and showing improved predictive validity relative to BDM.",
  "relation_type": "extends"
}