{
  "citation_substance": "mention_only",
  "rationale": "In the citing paper, Gupta, Lehmann, and Stuart (2004) appears mainly as one of many background references used to justify including certain customer metrics (e.g., acquisition cost, retention, customer profitability, CLV) in the disclosure checklist, especially in Table 1. The study is not given a distinct role in the paper's core theory, hypothesis development, identification strategy, or model specification for disclosure consequences. This is a literature-list/benchmark use rather than a specific intellectual dependency.",
  "relation_description": null,
  "relation_type": null
}