{
  "citation_substance": "mention_only",
  "rationale": "The cited paper appears only once, in a grouped citation that broadly notes marketing interest in image and multimedia features related to economic value. The citing paper does not rely on it for specific theory development, hypothesis logic, measurement, or method design, and it is not used to interpret focal findings. Its function is general background positioning rather than a distinct, paper-specific influence.",
  "relation_description": null,
  "relation_type": null
}