{
  "citation_substance": "mention_only",
  "rationale": "The cited paper appears only once in a grouped citation in the conceptual background, where it is used as general support for the claim that consumers may ignore nutrition information in hedonic or impulse categories. The citing study does not build directly on that paper's specific mechanisms, design, or findings, and it does not revisit the citation in modeling, measurement, or interpretation sections. This is best treated as a background literature mention rather than a distinct substantive dependency.",
  "relation_description": null,
  "relation_type": null
}