{
  "citation_substance": "mention_only",
  "rationale": "In the citing paper, Sethuraman and Srinivasan (2002) appears in a grouped citation used to justify a general point that managers may value unit sales effects in addition to elasticities. The paper does not discuss the cited study's asymmetric share effect theory or findings, nor does it build hypotheses, methods, or interpretation directly from that specific article. Because the reference serves as broad background support in a literature list rather than a distinct functional input, the citation is best classified as mention-only.",
  "relation_description": null,
  "relation_type": null
}