{
  "citation_substance": "mention_only",
  "rationale": "The cited paper is referenced briefly as supporting background that product heterogeneity can matter in e-mail marketing, and later as an analogy in the future-research section about possible customization uses. The citing paper does not build its empirical model, estimation approach, or core contribution on this cited work; its methodological foundation is primarily tied to Ansari, Essegaier, and Kohli (2000) and the authors' own triple-heterogeneity extension. Because the citation serves mainly as contextual example rather than a direct conceptual or methodological dependency, its role is a passing mention.",
  "relation_description": null,
  "relation_type": null
}