{
  "citation_substance": "mention_only",
  "rationale": "The cited paper appears in a grouped literature citation in the advertising dynamics section, used to support a general background claim that competitive clutter can reduce advertising effectiveness. The citing article does not engage this specific study's model, measures, or findings beyond that broad motivation, nor does it build a direct extension or comparison to it. Its function is therefore a passing contextual reference rather than a distinct building block in the paper's core analysis.",
  "relation_description": null,
  "relation_type": null
}