{
  "citation_substance": "substantive",
  "rationale": "The citing paper uses Kim and Hsieh (2003) as a direct measurement source: in the Appendix, the sales-partner-level switching-cost scale is explicitly marked as adapted from that study. This borrowed measure is then included as a control in the validation analysis (Table 6), so the citation has a concrete methodological role rather than being a generic background mention. At the same time, the cited paper is not used as a main theoretical anchor for the focal hypotheses.",
  "relation_description": "The citing study applies a measure from the cited paper by adapting its switching-cost scale for the sales-partner survey. The citation supports construct operationalization in the empirical design, especially in the validation model controls.",
  "relation_type": "applies"
}