{
  "citation_substance": "mention_only",
  "rationale": "The cited paper appears in a grouped literature-list citation where the authors briefly note prior work studying online advertising effectiveness using natural experiments. The citing paper does not separately discuss this paper's latent IV framework, paid search conversion model, or specific findings. It is not used to build the core hypotheses, empirical design, or interpretation in this article, so the role is background mention only.",
  "relation_description": null,
  "relation_type": null
}