{
  "citation_substance": "mention_only",
  "rationale": "In the citing paper, Katona et al. (2011) appears in grouped citations as one example of prior social-interaction research focused on adoption and as a general precedent for using observed friendship-network data. The text does not engage this specific paper's model, mechanisms, or results in a targeted way, and no hypothesis or empirical design element is explicitly derived from it alone. Its role is therefore background positioning rather than a distinct functional anchor for the citing study.",
  "relation_description": null,
  "relation_type": null
}