{
  "citation_substance": "mention_only",
  "rationale": "The cited paper appears only as part of a grouped citation in the data-collection section, where the authors note that prior Last.fm studies sampled a subset of users. The citing paper does not use this specific paper's core theory, mechanisms, or findings in hypothesis development, model specification, or result interpretation. There is no distinct functional role for this citation beyond generic methodological precedent/background for the dataset setup.",
  "relation_description": null,
  "relation_type": null
}