{
  "citation_substance": "mention_only",
  "rationale": "The cited paper appears only in a brief limitations/future-research discussion as an example of prior work that incorporates word-of-mouth effects in service return modeling. The citing paper does not build its core ROI model, hypotheses, estimation approach, or empirical design on this specific source. Its role is therefore a passing contextual mention rather than a meaningful input to the paper's main contribution.",
  "relation_description": null,
  "relation_type": null
}