{
  "citation_substance": "mention_only",
  "rationale": "In the provided PDF text, the 2021 slow-motion paper is present in the bibliography, but there is no clear in-text use of its findings, mechanism, measures, or design. The citing article develops its framework and hypotheses around gender-neutral marketing, binary gender stereotypes, and aesthetic attribute weighting using other explicitly discussed sources. Because this specific citation has no identifiable functional role in the argument or empirical setup, it is best classified as a passing/background citation.",
  "relation_description": null,
  "relation_type": null
}